id,publishedAt,channelId,title,channelTitle,duration,viewCount,likeCount,commentCount,status,subscriberCount,year,days_since_published,Length,clean_title
vQ88JB-lgtQ,2024-02-12 02:54:16,UCIrgJInjLS2BhlHOMDW7v0g,"""Well Said"" | Big Game Spot | Disney+",Disney Plus,PT31S,2892202,1969.0,309.0,public,1530000,2024,62,31,Well Said  Big Game Spot  Disney+
AJNUI0WqEdE,2024-02-12 03:21:18,UCq0OueAsdxH6b8nyAspwViw,Monkey Man | Elevator,Universal Pictures,PT31S,166043,5151.0,197.0,public,8770000,2024,62,31,Monkey Man  Elevator
DTLM5o-9hYg,2024-02-12 03:03:52,UCXQ7Gzszfuw84cEWGpKlFiQ,DoorDash | DoorDash All the Ads - :30,DoorDash,PT31S,210524,995.0,2200.0,public,63700,2024,62,31,DoorDash  DoorDash All the Ads - 30
lWVFBkx8_4E,2024-02-11 14:09:08,UC4aAdHyFHHMz48k2fNQAUGg,Homes.com | Quick question,Homes.com,PT31S,28388,84.0,16.0,public,4810,2024,63,31,Homes.com  Quick question
qoER8XCOPaM,2024-02-11 14:08:40,UC4aAdHyFHHMz48k2fNQAUGg,Homes.com | So tell us about this corn festival?,Homes.com,PT16S,31749742,16.0,2.0,public,4810,2024,63,16,Homes.com  So tell us about this corn festival
JRadjMeUKko,2024-02-12 02:00:06,UCF9imwPMSGz4Vq1NiTWCC7g,"IF | Big Game Spot (2024 Movie) - Ryan Reynolds, John Krasinski, Steve Carell",Paramount Pictures,PT31S,157459,1224.0,123.0,public,3410000,2024,62,31,"IF  Big Game Spot (2024 Movie) - Ryan Reynolds, John Krasinski, Steve Carell"
r7jpCZ1ju9I,2024-02-12 02:01:16,UCDF1rHyRH8LcxbHX5_mrZ0w,Can’t B Broken,Verizon,PT1M1S,226088,4708.0,203.0,public,460000,2024,62,61,Can’t B Broken
Ve2miT5iF2M,2024-02-12 02:40:27,UC6p8ND29iGJGr-Etl3-3PJA,"Dunkin’ ‘The DunKings’ ft Ben Affleck, Matt Damon, Tom Brady, Jack Harlow, Jennifer Lopez, & Fat Joe",Dunkin',PT1M1S,4817224,25761.0,1962.0,public,64600,2024,62,61,"Dunkin’ ‘The DunKings’ ft Ben Affleck, Matt Damon, Tom Brady, Jack Harlow, Jennifer Lopez, & Fat Joe"
7glIC7OaIro,2024-02-12 01:38:57,UCDVYQ4Zhbm3S2dlz7P1GBDg,NFL Super Bowl LVIII || Born to Play,NFL,PT2M27S,661380,3095.0,293.0,public,12800000,2024,62,147,NFL Super Bowl LVIII  Born to Play
PwExDWArh2Y,2024-03-14 04:36:20,UC5fsTA7ZSLf513EUdUX8sPA,Who is My Neighbor?,He Gets Us,PT31S,12065,56.0,16.0,public,29700,2024,31,31,Who is My Neighbor
4mPKDEfo0UM,2024-02-03 18:36:42,UC5o3WrC46mHoVOnkmAo9h2g,Pluto TV Couch Potato Farms,Pluto TV,PT1M1S,3605381,2198.0,207.0,public,47000,2024,70,61,Pluto TV Couch Potato Farms
5Od0aOse1wc,2024-02-12 09:53:19,UCkmEIhdd0mgRkDfGLz8BayQ,Temu's Big Game Ad Encore TV Commercial 2024,Temu,PT30S,216009765,11262.0,4345.0,public,239000,2024,62,30,Temu's Big Game Ad Encore TV Commercial 2024
vAf5TjiUJgo,2024-02-12 00:07:45,UCxeBIoLvY8Z-HUwlbbg1wNA,Michael CeraVe,CeraVe Skincare,PT31S,3325261,16492.0,1016.0,public,38800,2024,62,31,Michael CeraVe
JjLr4bdLPIs,2024-02-05 13:28:48,UCJOwq_trsKYpVWUpGuXeyAg,E*TRADE Baby Commercial - Picklebabies,E*TRADE from Morgan Stanley,PT31S,9771743,1220.0,67.0,public,62300,2024,69,31,ETRADE Baby Commercial - Picklebabies
p8ZYgb8Osek,2024-02-12 00:18:36,UCsjj_YdoShWrnAHrgN9ud-g,Like a Good Neighbaaa (:60) | feat. Arnold Schwarzenegger & Danny DeVito | State Farm® Commercial,State Farm Insurance,PT1M1S,888184,5108.0,396.0,public,248000,2024,62,61,Like a Good Neighbaaa (60)  feat. Arnold Schwarzenegger & Danny DeVito  State Farm® Commercial
94BqlDQ-Ppo,2024-02-11 23:39:07,UC5fsTA7ZSLf513EUdUX8sPA,Foot Washing,He Gets Us,PT1M1S,926204,5558.0,6609.0,public,29700,2024,62,61,Foot Washing
C3zN6lT_fPI,2024-02-26 16:18:54,UC4aAdHyFHHMz48k2fNQAUGg,Homes.com | Now that is worth celebrating,Homes.com,PT1M1S,656,6.0,1.0,public,4810,2024,48,61,Homes.com  Now that is worth celebrating
Neul4wINfUQ,2024-01-31 13:24:35,UC7EMFGoHNhe5aRwVmJyiFjA,Lindt LINDOR Life is a Ball,Lindt Chocolate USA,PT31S,1073476,328.0,51.0,public,6270,2024,74,31,Lindt LINDOR Life is a Ball
1MXYI3ZKLqQ,2024-02-11 23:32:49,UCoY7BdcEOPX3Bus0e2VGFXw,Apartments.com | Extraterrentrials | :30,Apartments.com,PT31S,430918,287.0,61.0,public,31000,2024,62,31,Apartments.com  Extraterrentrials  30
Nan333CuBm4,2024-03-21 17:06:26,UC2-BeLxzUBSs0uSrmzWhJuQ,Kingdom of the Planet of the Apes | King,20th Century Studios,PT31S,509286,9778.0,528.0,public,4740000,2024,24,31,Kingdom of the Planet of the Apes  King
F1dvX9Vs0ns,2024-02-11 23:45:31,UCq0OueAsdxH6b8nyAspwViw,Wicked - First Look,Universal Pictures,PT1M1S,5348159,122068.0,14209.0,public,8770000,2024,62,61,Wicked - First Look
BEkziTXz9Js,2024-02-08 05:00:08,UCsRdY9CtEVWTNO4ulwfzqVA,CrowdStrike | The Future | Extended Cut,CrowdStrike,PT1M1S,73984,263.0,0.0,public,18800,2024,66,61,CrowdStrike  The Future  Extended Cut
5UiFkOJoP-8,2024-02-02 13:02:14,UCde5lyhz54IYdyrbGA5F5rg,Tina Fey books whoever she wants to be | Booking.com 2024 Big Game ad,Booking.com,PT31S,132820033,1494.0,136.0,public,637000,2024,72,31,Tina Fey books whoever she wants to be  Booking.com 2024 Big Game ad
H3EsFtUCOno,2024-01-31 15:02:21,UCYrx7f8QvhZKKh7a0815UuA,Imagine a world where the twist of an OREO could change everything. Literally everything.,OREO Cookie,PT31S,2094144,469.0,74.0,public,754000,2024,74,31,Imagine a world where the twist of an OREO could change everything. Literally everything.
1xA7ENrLtUw,2024-02-02 14:56:51,UCk7J8uoy0aVBDgQCw9YMlLg,Starry | Super Bowl 2024 | It’s Time To See Other Sodas,Starry,PT31S,4092766,4106.0,325.0,public,57500,2024,72,31,Starry  Super Bowl 2024  It’s Time To See Other Sodas
Ej7fYDHlCbA,2024-02-05 15:00:04,UCnQdLSHPmjcDdT5whDBlHtQ,Coors Light Chill Train | Big Game Ad :30,Coors Light,PT31S,47877,95.0,11.0,public,26000,2024,69,31,Coors Light Chill Train  Big Game Ad 30
SJa1oSgs8Gw,2024-02-11 17:11:14,UCq7OHvWO6Z3u-LztFdrcU-g,Despicable Me 4 - Minion Intelligence (Big Game Spot),Illumination,PT31S,2163332,13214.0,0.0,public,4060000,2024,63,31,Despicable Me 4 - Minion Intelligence (Big Game Spot)
XZmMvVCcW0M,2024-02-02 14:44:04,UCztgL4XE-1dlmW1aSLmBPng,STōK Cold Brew Unleashes Sir Anthony Hopkins' Inner Wred Dragon,SToK Cold Brew,PT56S,284352,469.0,44.0,public,1280,2024,72,56,STōK Cold Brew Unleashes Sir Anthony Hopkins' Inner Wred Dragon
cXT8JgdvCHc,2024-02-01 14:57:17,UCrU8iuSBmgZUNUoU1-sYfbQ,Gift Mode: Etsy’s 2024 Big Game Commercial,Etsy,PT29S,384374,896.0,162.0,public,103000,2024,73,29,Gift Mode Etsy’s 2024 Big Game Commercial
sfB-glrgn5o,2024-02-05 14:10:26,UCBSVw6f8KBFLn7r1cQsFhLw,"BMW USA | Christopher Walken in ""Talkin Like Walken"" (ft. Usher)",BMW USA,PT1M1S,3807462,11631.0,800.0,public,307000,2024,69,61,BMW USA  Christopher Walken in Talkin Like Walken (ft. Usher)
aYvDdZZ_FQU,2024-02-05 14:00:46,UCZsJ3Wnkzbhw3StGShdWiDw,Pringles | Mr. P,Pringles U.S.,PT31S,4198671,1492.0,87.0,public,22800,2024,69,31,Pringles  Mr. P
YVeCwSWNLrM,2024-02-05 13:30:08,UCJWjiXxsH7Nb2354JHI4q0Q,That T-Mobile Home Internet Feeling | 2024 Big Game Day Commercial | T-Mobile Home Internet,T-Mobile,PT1M1S,56884820,8942.0,796.0,public,535000,2024,69,61,That T-Mobile Home Internet Feeling  2024 Big Game Day Commercial  T-Mobile Home Internet
sOH23Pup6AQ,2024-02-05 15:00:46,UCc9-kl38p_uzQDVrT06VTxA,REESE'S Cups Big Game Commercial 2024 | Yes! :30,Reeses,PT31S,620198,2834.0,400.0,public,283000,2024,69,31,REESE'S Cups Big Game Commercial 2024  Yes! 30
LOhNE2zCvEs,2024-02-11 18:16:01,UCx4287tWK7d49swYs7siHkQ,Cardi B x NYX Cosmetics 2024 Commercial (The Big Game Version),NYX Cosmetics,PT32S,40265,279.0,42.0,public,150000,2024,62,32,Cardi B x NYX Cosmetics 2024 Commercial (The Big Game Version)
9UBWFIArQxs,2024-02-06 12:57:48,UCWStqpgu1Pt3VhXCOGlmkkw,The M&M’S Almost Champions Ring of Comfort – :30 Super Bowl Ad,M&M'S,PT31S,418198,1315.0,94.0,public,189000,2024,68,31,The M&M’S Almost Champions Ring of Comfort – 30 Super Bowl Ad
pAdDi6G74mc,2024-02-06 14:27:52,UCsdqpqgsSFTRSnyyqHVSgyw,MTN DEW | Aubrey Plaza Having a Blast Super Bowl Ad,Mountain Dew,PT31S,3231710,5736.0,0.0,public,227000,2024,68,31,MTN DEW  Aubrey Plaza Having a Blast Super Bowl Ad
Y7mLeyIETu0,2024-02-11 13:00:15,UC1xnncYc7586km_rIYQLtLQ,DON'T FORGET UBER EATS,Uber Eats,PT1M1S,379488,2173.0,285.0,public,307000,2024,63,61,DON'T FORGET UBER EATS
qQJyZseER6I,2024-02-05 14:59:29,UCOrEfQ0aa6Wro8UfK5gm5HA,Dina & Mita,Doritos Dinamita,PT1M1S,286698,1067.0,83.0,public,1370,2024,69,61,Dina & Mita
NBuB85VsZfI,2024-02-07 14:00:52,UCMvBjCzggK1Xd5TNBxVqZwA,NFL Sunday Ticket | Migration,YouTube TV,PT1M1S,712173,3974.0,331.0,public,400000,2024,67,61,NFL Sunday Ticket  Migration
kwUJq0DA0xo,2024-02-08 23:16:50,UCQAFPcPAmO6XuPOPqosGk9A,The Future of Soda is Now | Poppi Super Bowl LVIII 2024 Commercial,poppi,PT1M1S,165150,262.0,42.0,public,310,2024,65,61,The Future of Soda is Now  Poppi Super Bowl LVIII 2024 Commercial
c04_GeQZFFw,2024-02-12 02:16:25,UC5vFx0GahDIWLMFm5j2_JZA,Big Game Commercial 2024 | Volkswagen,Volkswagen USA,PT1M1S,5127709,2825.0,902.0,public,294000,2024,62,61,Big Game Commercial 2024  Volkswagen
6zolFHbtEew,2024-02-07 01:52:42,UCGQnsq2JN3hANZ9QU0nidUg,Skechers '24 Big Game Spot: Mr. T in Skechers,SKECHERS,PT31S,26688575,2146.0,103.0,public,114000,2024,67,31,Skechers '24 Big Game Spot Mr. T in Skechers
SaCVSUbYpVc,2024-02-07 15:00:01,UCFtEEv80fQVKkD4h1PF-Xqw,Microsoft Game Day Commercial | Copilot: Your everyday AI companion,Microsoft,PT1M1S,16665860,4421.0,373.0,public,1510000,2024,67,61,Microsoft Game Day Commercial  Copilot Your everyday AI companion
kjVf8ptmDmk,2024-02-07 12:00:44,UCYBe3cPCbjUManWo2Mg8tNg,In e.l.f we Trust | e.l.f Cosmetics Game Day Commercial 2024,e.l.f. Cosmetics,PT1M1S,4385226,3172.0,310.0,public,124000,2024,67,61,In e.l.f we Trust  e.l.f Cosmetics Game Day Commercial 2024
i4_Lat2hl3Q,2024-02-08 17:30:11,UCbp3o7U6oSa6s-LQBZvOnGg,Perfect 10: The Kia big game commercial featuring the 2024 Kia EV9 (:30),Kia America,PT41S,16123964,1856.0,29.0,public,151000,2024,66,41,Perfect 10 The Kia big game commercial featuring the 2024 Kia EV9 (30)
fQ7Az_7pzDM,2024-02-08 13:59:47,UC1pOTJteEef10zJM0cHs4iQ,“Dareful Handle” | The all-new 2024 Tacoma | Toyota Super Bowl LVIII Commercial,Toyota USA,PT31S,234035,807.0,111.0,public,765000,2024,66,31,“Dareful Handle”  The all-new 2024 Tacoma  Toyota Super Bowl LVIII Commercial
zo8PQgark7c,2024-02-06 12:27:47,UCBEZh6fiU1m_7uf3JnLObZQ,"""The Wait Is Over"" :60",Popeyes,PT1M1S,3989405,1962.0,156.0,public,18000,2024,68,61,The Wait Is Over 60
bXrhgATNVbE,2024-02-12 00:49:33,UCbPP6F-3ASqkBkT9Obro-TQ,FanDuel Kick of Destiny 2 featuring Rob Gronkowski,FanDuel,PT31S,184105,406.0,251.0,public,76100,2024,62,31,FanDuel Kick of Destiny 2 featuring Rob Gronkowski
wdok0rZdmx4,2024-02-12 00:20:50,UCq0OueAsdxH6b8nyAspwViw,TWISTERS | Official Trailer,Universal Pictures,PT2M,19639953,70956.0,11857.0,public,8770000,2024,62,120,TWISTERS  Official Trailer
-kI-vfyl2mo,2024-02-06 18:32:00,UCuoRexsKlYTnJHL6gMun1XQ,NERDS Big Game Commercial ft. Addison Rae | Official :30 | 2024,NERDS Candy,PT31S,466908,935.0,93.0,public,2290,2024,67,31,NERDS Big Game Commercial ft. Addison Rae  Official 30  2024
oGnyO_lEW2E,2024-02-02 14:00:39,UCPdWjNqPsxPR9SDkof1LMKg,Silk Feel Planty Good,The Silk Channel,PT31S,174424,469.0,66.0,public,9620,2024,72,31,Silk Feel Planty Good
wYPTZIFQoDQ,2024-02-02 19:30:58,UCIG1k8umaCIIrujZPzZPIMA,Javier in Frame | Google Pixel SB Commercial 2024,Made by Google,PT1M1S,50274275,4395.0,349.0,public,1620000,2024,71,61,Javier in Frame  Google Pixel SB Commercial 2024
f1cPVuT8q_w,2024-01-27 16:00:29,UCKpQy6TKwFDHBpo-PKd8YyQ,BetMGM Big Game Commercial - 'Tom Has Won Enough',BetMGM,PT1M1S,1279015,1906.0,195.0,public,7970,2024,78,61,BetMGM Big Game Commercial - 'Tom Has Won Enough'
mrHEtU98yVY,2024-02-06 23:45:35,UC6La6rXZWTIQEJYOn-N0Yhw,"Kawasaki 2024 Big Game Ad ""Mullets"" Official TV Spot",Kawasaki USA,PT31S,50343,151.0,12.0,public,132000,2024,67,31,Kawasaki 2024 Big Game Ad Mullets Official TV Spot
aUnKqXTSJWU,2024-01-30 14:32:04,UCi-h-thQ2WT-8gaTAjtlKUw,Mayo Cat – Hellmann’s Big Game :60,Hellmann's,PT1M1S,4539198,2727.0,0.0,public,37200,2024,75,61,Mayo Cat – Hellmann’s Big Game 60
8C4DNSV3IRE,2024-01-31 14:00:13,UCPCk_8dtVyR1lLHMBEILW4g,Budweiser | Super Bowl LVIII Old School Delivery,Budweiser,PT1M1S,3593853,19059.0,1018.0,unlisted,218000,2024,74,61,Budweiser  Super Bowl LVIII Old School Delivery
1Lr4MRaOxhk,2024-02-02 15:47:23,UCRSEK5yqB6GGC_b3DTUqaiw,Drumstick | Doctor on the Plane,Drumstick,PT31S,1365348,256.0,23.0,public,386,2024,72,31,Drumstick  Doctor on the Plane
5YsxXj5kycs,2023-02-10 06:30:11,UCz97F7dMxBNOfGYu3rx8aCw,"65 Million Years Ago, BIG GAME Meant Something Very Different",Sony Pictures Entertainment,PT31S,411329,2076.0,166.0,public,7150000,2023,429,31,"65 Million Years Ago, BIG GAME Meant Something Very Different"
wlPM7E8uLJ8,2023-02-12 23:43:27,UCMvBjCzggK1Xd5TNBxVqZwA,Football Cat — NFL Sunday Ticket is coming soon to YouTube TV,YouTube TV,PT31S,174802,167.0,16.0,public,400000,2023,426,31,Football Cat — NFL Sunday Ticket is coming soon to YouTube TV
KUmMQ5q58Io,2023-01-28 23:00:08,UCf5CjDJvsFvtVIhkfmKAwAA,CREED III | Directed by Michael B. Jordan – Only in theaters March 3,MGM,PT31S,7174862,4076.0,178.0,public,1150000,2023,441,31,CREED III  Directed by Michael B. Jordan – Only in theaters March 3
73p4lL1iq7w,2023-02-13 03:02:58,UCNDsk0uhSlG1-br1Ex2Rgfg,Tubi Interface Interruption | Super Bowl,Tubi,PT16S,1640730,13257.0,1593.0,public,699000,2023,426,16,Tubi Interface Interruption  Super Bowl
UEx75kcWgxc,2023-02-13 01:57:54,UCyouSlyNTfwX_pnGvlfIL3Q,AIR: Courting A Legend | Big Game Spot,Amazon Studios,PT1M1S,19997,123.0,7.0,public,108000,2023,426,61,AIR Courting A Legend  Big Game Spot
-bueUljGJ2M,2023-02-13 02:36:08,UCkLXELm63_pH7L-r-548kig,Saving Sawyer | Amazon's Big Game Ad,amazon,PT1M31S,553596,3411.0,830.0,unlisted,576000,2023,426,91,Saving Sawyer  Amazon's Big Game Ad
KfcHMpNYnpw,2023-02-13 14:07:30,UCQQQO7Kdo0cu9iEb19qOoYA,NFL Super Bowl LVII Commercial || Run With It,Cleveland Browns,PT2M1S,37782,355.0,30.0,public,275000,2023,426,121,NFL Super Bowl LVII Commercial  Run With It
cjiPkaGdbAQ,2023-02-13 04:04:55,UCbPP6F-3ASqkBkT9Obro-TQ,FanDuel Kick of Destiny featuring Rob Gronkowski,FanDuel,PT31S,272192,476.0,272.0,public,76100,2023,426,31,FanDuel Kick of Destiny featuring Rob Gronkowski
8gatiYW5kWs,2023-02-13 01:27:46,UCsRdY9CtEVWTNO4ulwfzqVA,CrowdStrike | Troy,CrowdStrike,PT31S,11817555,2364.0,29.0,public,18800,2023,426,31,CrowdStrike  Troy
GtyxWvifru8,2023-02-13 01:50:19,UCNDsk0uhSlG1-br1Ex2Rgfg,Tubi Rabbit Hole | Super Bowl,Tubi,PT1M1S,713138,4127.0,586.0,public,699000,2023,426,61,Tubi Rabbit Hole  Super Bowl
jzE68RiXbT8,2023-02-13 01:21:01,UCYBe3cPCbjUManWo2Mg8tNg,eyes. lips. face. sticky.  | e.l.f. Cosmetics Game Day Commercial 2023,e.l.f. Cosmetics,PT32S,238439,1179.0,150.0,public,124000,2023,426,32,eyes. lips. face. sticky.   e.l.f. Cosmetics Game Day Commercial 2023
h4my8CdjU8w,2023-02-13 01:06:22,UCXCWuXpCJXoJV17dKvomfLg,"Miller Lite, Coors Light & Blue Moon Big Game Commercial 2023 | The High Stakes Beer Ad",Miller Lite,PT31S,10180,50.0,23.0,unlisted,27200,2023,426,31,"Miller Lite, Coors Light & Blue Moon Big Game Commercial 2023  The High Stakes Beer Ad"
atz-Zl5ou9o,2023-02-17 19:15:58,UCgFF_YNB_TzYzEUr6oSfkGQ,"Heineken 0.0|Ant-Man and The Wasp: Quantumania (BIG Game Spot)–Shrinking and Drinking, Now You Can!",HeinekenUSA,PT30S,306500,613.0,32.0,public,36700,2023,421,30,"Heineken 0.0Ant-Man and The Wasp Quantumania (BIG Game Spot)–Shrinking and Drinking, Now You Can!"
f5x1RyJOwP8,2023-02-12 18:01:47,UC5fsTA7ZSLf513EUdUX8sPA,Love Your Enemies,He Gets Us,PT1M1S,5965161,9434.0,3313.0,public,29700,2023,427,61,Love Your Enemies
M0zdJOM_5Vg,2023-02-13 00:23:56,UCjmJDM5pRKbUlVIzDYYWb6g,The Flash – Big Game TV Spot,Warner Bros. Pictures,PT50S,1455446,41189.0,1896.0,public,11600000,2023,426,50,The Flash – Big Game TV Spot
8oBHRjnQCFE,2023-02-12 23:55:04,UCJCx8aQrdx_ueXPmxTD2odQ,FAST X | Big Game Spot,The Fast Saga,PT1M1S,488635,11079.0,471.0,public,2170000,2023,426,61,FAST X  Big Game Spot
BBIX9FG6kZ0,2023-02-12 23:54:25,UC6p8ND29iGJGr-Etl3-3PJA,Dunkin' 'Drive-Thru' Starring Ben,Dunkin',PT31S,6625965,9314.0,675.0,public,64600,2023,426,31,Dunkin' 'Drive-Thru' Starring Ben
qXBsJW4LOCQ,2023-02-12 23:20:25,UC_BaxRhNREI_V0DVXjXDALA,The legendary Porsche 911 Carrera RS 3.8 in Transformers: Rise of the Beasts,Porsche,PT31S,5323356,6834.0,486.0,public,1320000,2023,426,31,The legendary Porsche 911 Carrera RS 3.8 in Transformers Rise of the Beasts
de5m3NWhi-Y,2023-02-10 14:00:01,UCF9imwPMSGz4Vq1NiTWCC7g,Dungeons & Dragons: Honor Among Thieves | Big Game Spot (2023 Movie),Paramount Pictures,PT31S,151249,1209.0,95.0,public,3410000,2023,429,31,Dungeons & Dragons Honor Among Thieves  Big Game Spot (2023 Movie)
IAIo-pUDl0s,2023-02-10 15:48:35,UC3leux6UUKfAiNxlZeiMg7g,"""Forever"": The Farmer’s Dog 2023 Super Bowl Commercial",The Farmer's Dog,PT1M1S,3422034,4054.0,386.0,public,6730,2023,429,61,Forever The Farmer’s Dog 2023 Super Bowl Commercial
mTnavAlWnJg,2023-02-09 16:00:23,UCPgMAS8woHJ_o_OZdTR7kcQ,Poker Face Super Bowl Ad | Charlie Calls Bullsh*t,Peacock,PT51S,198017,434.0,46.0,public,1860000,2023,430,51,Poker Face Super Bowl Ad  Charlie Calls Bullsht
jSO-Whn2sCQ,2023-02-09 14:00:06,UCJWjiXxsH7Nb2354JHI4q0Q,New year. New neighbor. | 2023 Big Game Day Commercial | T-Mobile Home Internet,T-Mobile,PT1M1S,56371049,11124.0,1219.0,public,535000,2023,430,61,New year. New neighbor.  2023 Big Game Day Commercial  T-Mobile Home Internet
f8LE9gxtxTY,2023-02-06 22:44:24,UChk5y5vgtsfHK33ayU1cCCQ,"Dialpad -  ""The Good Ai "" (Ai That Works for You)",Dialpad,PT31S,1134984,1048.0,28.0,public,4260,2023,432,31,Dialpad -  The Good Ai  (Ai That Works for You)
6uLgF2K2n5M,2023-02-08 14:00:00,UCF9imwPMSGz4Vq1NiTWCC7g,Scream VI | Big Game Spot (2023 Movie),Paramount Pictures,PT55S,627956,10295.0,843.0,public,3410000,2023,431,55,Scream VI  Big Game Spot (2023 Movie)
fdN0GWOtsHQ,2023-02-08 16:36:06,UCGQnsq2JN3hANZ9QU0nidUg,Skechers x Snoop Dogg Big Game Commercial,SKECHERS,PT31S,35507147,28319.0,344.0,unlisted,114000,2023,431,31,Skechers x Snoop Dogg Big Game Commercial
ZSSpnEd2pTE,2023-02-24 14:16:26,UCQcTMI8HUqmt_rDIO2JDeBg,Sam Adams | 2023 Big Game Commercial | Your Cousin’s Brighter Boston :30,SamuelAdams,PT31S,1961741,211.0,22.0,public,15500,2023,415,31,Sam Adams  2023 Big Game Commercial  Your Cousin’s Brighter Boston 30
h5D5BQM6D-M,2023-02-07 15:16:05,UCTu-ytEHtR_0eKmOhAyWiyg,WeatherTech Big Game 2023: We All Win,WeatherTech,PT31S,253705,142.0,0.0,public,32700,2023,432,31,WeatherTech Big Game 2023 We All Win
gKCScoG83SA,2023-02-07 13:31:10,UCZsJ3Wnkzbhw3StGShdWiDw,Pringles | Best of Us :30,Pringles U.S.,PT31S,11474733,945.0,67.0,unlisted,22800,2023,432,31,Pringles  Best of Us 30
8Bsgj1ihEOg,2023-02-06 14:00:21,UCTqeresI0k6ro2gVBcoVlDA,Downy Unstopables Super Bowl Commercial: Call Me Downy McBride,Downy,PT46S,307134,362.0,51.0,unlisted,30100,2023,433,46,Downy Unstopables Super Bowl Commercial Call Me Downy McBride
azCNwGnxq0s,2023-02-02 15:00:01,UC1O6nGbccGhl2akEVaSpKsA,"BUD LIGHT HOLD | EASY TO DRINK, EASY TO ENJOY :60",Bud Light,PT1M1S,17205014,8613.0,2712.0,public,199000,2023,437,61,"BUD LIGHT HOLD  EASY TO DRINK, EASY TO ENJOY 60"
ev82iHoLk8s,2022-02-14 00:42:43,UCq0OueAsdxH6b8nyAspwViw,Ambulance - Only In Theaters April 8,Universal Pictures,PT32S,144815,2536.0,194.0,public,8770000,2022,790,32,Ambulance - Only In Theaters April 8
-x__vh1H0dQ,2022-02-14 00:15:45,UCq0OueAsdxH6b8nyAspwViw,NOPE | SBLVI SPOT,Universal Pictures,PT31S,140838,3487.0,185.0,public,8770000,2022,790,31,NOPE  SBLVI SPOT
QhqGCPMfkNM,2022-01-19 15:00:31,UCQJWtTnAHhEG5w4uN0udnUQ,The Lord of the Rings: The Rings of Power  - Title Announcement | Prime Video,Prime Video,PT1M1S,4453445,76859.0,9767.0,public,3460000,2022,816,61,The Lord of the Rings The Rings of Power  - Title Announcement  Prime Video
AV8NXzi5Lj0,2022-02-14 00:39:48,UCIrgJInjLS2BhlHOMDW7v0g,Disney+ Has All the GOATs | Disney+,Disney Plus,PT31S,643622,3407.0,345.0,public,1530000,2022,790,31,Disney+ Has All the GOATs  Disney+
B4QI0VzbkHk,2022-02-13 22:36:32,UC9ZqNBEjEU1NK475EvqmlLA,Polestar - No Compromises: The Superbowl commercial | Polestar,Polestar Cars,PT31S,367593,2782.0,929.0,public,83400,2022,790,31,Polestar - No Compromises The Superbowl commercial  Polestar
KM3Yx-5Ymiw,2022-02-13 23:44:28,UCvC4D8onUfXzvjTOM-dBfEA,Big Game TV Spot | Marvel Studios’ Moon Knight | Disney+,Marvel Entertainment,PT31S,5008793,185569.0,4119.0,public,20400000,2022,790,31,Big Game TV Spot  Marvel Studios’ Moon Knight  Disney+
UihVmkDISsg,2022-02-01 16:40:32,UCUnC4wPTiAmMypWHXGwqh-Q,Flamin' Hot I Super Bowl LVI TV Spot,Cheetos,PT1M1S,259516,2389.0,0.0,public,98700,2022,803,61,Flamin' Hot I Super Bowl LVI TV Spot
rjZ_O-c3QRw,2022-02-09 02:00:43,UCZsJ3Wnkzbhw3StGShdWiDw,Pringles | Stuck In :90,Pringles U.S.,PT1M31S,618489,4087.0,366.0,public,22800,2022,795,91,Pringles  Stuck In 90
nUC1QA5gRcU,2022-02-09 00:00:09,UCBSVw6f8KBFLn7r1cQsFhLw,Zeus & Hera | BMW USA (Official Video),BMW USA,PT1M1S,14057223,45815.0,2155.0,unlisted,307000,2022,795,61,Zeus & Hera  BMW USA (Official Video)
X5-nAFdvg7c,2022-02-11 20:11:58,UCGQnsq2JN3hANZ9QU0nidUg,Willie Nelson for Skechers – “On the Road” Big Game commercial,SKECHERS,PT31S,339370,893.0,56.0,unlisted,114000,2022,792,31,Willie Nelson for Skechers – “On the Road” Big Game commercial
Vs0YHD0JoCk,2022-02-01 14:14:54,UC1O6nGbccGhl2akEVaSpKsA,Bud Light Seltzer Hard Soda - Land of Loud Flavors (:60s),Bud Light,PT1M1S,319624,815.0,78.0,unlisted,199000,2022,803,61,Bud Light Seltzer Hard Soda - Land of Loud Flavors (60s)
YPV7X8_zKfc,2022-02-10 16:44:13,UCGAWuGsaWysuMHbj0w2-Ffw,The Grande Escape (Commercial) | Taco Bell,Taco Bell,PT31S,87463,577.0,48.0,unlisted,145000,2022,794,31,The Grande Escape (Commercial)  Taco Bell
CMaispXEh94,2022-02-09 15:49:18,UCGaOvAFinZ7BCN_FDmw74fQ,Stuff | Made to Travel | 30 | Expedia,Expedia,PT31S,50096317,1018.0,174.0,unlisted,1170000,2022,795,31,Stuff  Made to Travel  30  Expedia
YchR7cbFuAU,2022-02-09 00:57:00,UCde5lyhz54IYdyrbGA5F5rg,Idris for Booking.com - the #1 accommodation site on Planet Earth.,Booking.com,PT30S,19974,91.0,9.0,public,637000,2022,795,30,Idris for Booking.com - the #1 accommodation site on Planet Earth.
fwnbHVYgprA,2022-02-08 15:01:09,UCTu-ytEHtR_0eKmOhAyWiyg,WeatherTech Big Game Commercial 2022 - Special Ops: Fit Crew,WeatherTech,PT30S,2293785,4199.0,0.0,public,32700,2022,796,30,WeatherTech Big Game Commercial 2022 - Special Ops Fit Crew
YpKYj8edUOg,2022-02-02 17:30:09,UCCXzwmWklkj1l6xBp0GxRLQ,Carvana - Official Big Game Commercial 2022 - “Oversharing Mom”,Carvana,PT31S,24357537,1577.0,244.0,public,25200,2022,802,31,Carvana - Official Big Game Commercial 2022 - “Oversharing Mom”
_wkvH0qBMP8,2021-02-08 00:30:01,UCUgrUBKwSnXwQOBG4v3igMg,"Wow, that actually worked.",Reddit,PT7S,107467,1488.0,98.0,public,271000,2021,1161,7,"Wow, that actually worked."
vDHNMqOLw_o,2021-02-03 15:51:53,UCfb6EofrRqeK6ttHgxZRjcA,Dr. Squatch Super Bowl LV Commercial 2021 - You're Not A Dish,Dr. Squatch,PT30S,2808204,7034.0,594.0,public,84600,2021,1166,30,Dr. Squatch Super Bowl LV Commercial 2021 - You're Not A Dish
5L6juLUkwuw,2021-02-05 13:22:28,UCJWjiXxsH7Nb2354JHI4q0Q,Tom Brady & Rob Gronkowski | Big Game Ad | #TheGOATin5G | T-Mobile,T-Mobile,PT1M1S,40024011,47455.0,2330.0,public,535000,2021,1164,61,Tom Brady & Rob Gronkowski  Big Game Ad  #TheGOATin5G  T-Mobile
eB1m-WogYeg,2021-02-07 23:46:20,UCq0OueAsdxH6b8nyAspwViw,Old - The Big Game Spot [HD],Universal Pictures,PT31S,7479024,12302.0,2021.0,public,8770000,2021,1161,31,Old - The Big Game Spot [HD]
9cEiYQwYLPk,2021-02-08 00:17:26,UCsdqpqgsSFTRSnyyqHVSgyw,WIN $1MILLION! | 2021 “MTN DEW MAJOR MELON Bottle Count” w/ John Cena,Mountain Dew,PT31S,2247816,2096.0,537.0,unlisted,227000,2021,1161,31,WIN $1MILLION!  2021 “MTN DEW MAJOR MELON Bottle Count” w John Cena
yfLz54hzpPs,2021-02-04 16:45:23,UCZMzrsDVmBL8Vn4SAjc4-uQ,Bass Pro Shops and Cabela’s Super Bowl Commercial 2021: Get Back to Nature,Bass Pro Shops,PT1M1S,4059151,1175.0,100.0,public,62300,2021,1165,61,Bass Pro Shops and Cabela’s Super Bowl Commercial 2021 Get Back to Nature
7ZUT9ftBWI8,2021-02-03 13:46:09,UCY0Ad2H_36GDhtnt7LcLwFg,Meet the King :30 | Jimmy John’s,Jimmy John's,PT31S,1623886,145.0,14.0,unlisted,8900,2021,1166,31,Meet the King 30  Jimmy John’s
_nwSmOEiDls,2021-02-03 14:01:24,UChVe2hDZiYScBIrZuxYRY7g,Super Bowl Ad: Join The First All-Civilian Space Mission | Inspiration4,Inspiration4,PT31S,231281,1595.0,220.0,public,5660,2021,1166,31,Super Bowl Ad Join The First All-Civilian Space Mission  Inspiration4
dgu5ppBIr9A,2020-10-13 17:15:18,UCGQnsq2JN3hANZ9QU0nidUg,Tony Romo for Skechers Max Cushioning,SKECHERS,PT31S,243408,350.0,54.0,unlisted,114000,2020,1279,31,Tony Romo for Skechers Max Cushioning
aaC457-XO9M,2021-02-08 00:50:40,UCUl9nbw8dq8oVJU-DXoTpYA,"Welcome to the World, Baby | Huggies® Official Big Game Commercial",Huggies® Brand,PT31S,8532835,2340.0,52.0,public,40700,2021,1161,31,"Welcome to the World, Baby  Huggies® Official Big Game Commercial"
xxNxqveseyI,2021-02-02 13:25:20,UCkLXELm63_pH7L-r-548kig,Amazon’s Big Game Commercial: Alexa’s Body,amazon,PT1M1S,78547489,57155.0,7912.0,unlisted,576000,2021,1167,61,Amazon’s Big Game Commercial Alexa’s Body
R2Wkk-TDnRQ,2021-02-02 14:59:43,UCTu-ytEHtR_0eKmOhAyWiyg,WeatherTech We Never Left Super Bowl Commercial 2021,WeatherTech,PT31S,51447,107.0,0.0,public,32700,2021,1167,31,WeatherTech We Never Left Super Bowl Commercial 2021
rF6Jjm5547k,2021-02-02 14:59:21,UCTu-ytEHtR_0eKmOhAyWiyg,WeatherTech Family Super Bowl Commercial 2021,WeatherTech,PT31S,97627,136.0,0.0,public,32700,2021,1167,31,WeatherTech Family Super Bowl Commercial 2021
62EB4JniuTc,2020-02-03 02:16:01,UCvC4D8onUfXzvjTOM-dBfEA,“Big Game” Spot | Marvel Studios | Disney+,Marvel Entertainment,PT31S,8965167,261360.0,10550.0,public,20400000,2020,1532,31,“Big Game” Spot  Marvel Studios  Disney+
7BgcG_l9J0A,2020-02-03 00:49:14,UCwTkM6CvIsYFaFiMKIKCqHw,NO TIME TO DIE | Official Game Day Spot 2020,James Bond 007,PT31S,2132591,18996.0,1704.0,public,885000,2020,1532,31,NO TIME TO DIE  Official Game Day Spot 2020
